{
  "snapshot_id": "public-case-real-estate-studio-desarrolladoras-residenciales-boutique-en-preventa-financials",
  "company_id": "public-case-real-estate-studio",
  "currency_code": "MXN",
  "customer_lifetime_months": 4.0,
  "average_monthly_revenue_per_customer": 117619.05,
  "gross_margin_ratio": 0.63,
  "estimated_cac": 18000.0,
  "estimated_ltv": 298476.2,
  "ltv_cac_ratio": 16.58,
  "payback_months": 0.24,
  "break_even_customers": 0.96,
  "viability_warning": "La viabilidad se ve defendible si el estudio vende un paquete unificado y evita entrar a descuentos por pieza o por ronda fuera de alcance.",
  "status": "inferred",
  "confidence": 0.73,
  "source_origin": "financials_engine",
  "evidence_refs": [
    "2026-03-18-preventa-necesita-material-que-si-venda",
    "2026-03-18-cambios-de-proyecto-rompen-las-piezas",
    "2026-03-18-tour-360-filtra-visitas",
    "2026-03-18-confianza-remota-antes-del-showroom",
    "2026-03-18-buyer-quiere-paquete-unificado"
  ],
  "source_refs": [
    "2026-03-18-founder-sales-notes",
    "2026-03-18-buyer-objections-board"
  ],
  "assumption_refs": [
    "public-case-real-estate-studio-financial-assumption-lifetime",
    "public-case-real-estate-studio-financial-assumption-cac",
    "public-case-real-estate-studio-financial-assumption-costs"
  ],
  "finding_refs": [],
  "validated_fact_refs": [],
  "created_at": "2026-03-18T17:07:10",
  "updated_at": "2026-03-18T17:07:10"
}
